{
  "schemaVersion": "1.0.0",
  "projectName": "archspine",
  "role": "Semantic indexing and protocol tooling for repository knowledge graphs.",
  "responsibility": "Builds machine-readable semantic contracts and derived documentation under .spine.",
  "modules": [
    {
      "directory": "src",
      "role": "Runtime and indexing pipeline implementation.",
      "childCount": 14
    },
    {
      "directory": "docs",
      "role": "Specification and strategy assets.",
      "childCount": 4
    }
  ],
  "provenance": {
    "indexedAt": "2026-04-02T10:00:00Z",
    "generatorVersion": "archspine/1.0.0",
    "pipelineStages": ["ast", "llm"]
  }
}
